Secao,Titulo,Descrição,Data
economia,Zelenskiy pede ajuda do México com plano de paz,"CIDADE DO MÉXICO (Reuters) – O presidente ucraniano, Volodymyr Zelenskiy, pediu nesta quinta-feira ao México que ajude a defender na América Latina seu plano de paz para a Ucrânia, mesmo com as tensões persistindo dentro do partido que governa o país sobre o oferecimento de apoio a Kiev. O governo do México disse que quer […]",20/04/2023 21:22
economia,"Reino Unido eleva cotas de importação de carne de aves do Brasil, diz ABPA","Por Nayara Figueiredo SÃO PAULO (Reuters) – O Reino Unido publicou nesta semana os volumes atualizados das cotas de carne de aves do Brasil, para embarque da proteína brasileira com tarifas diferenciadas, e aumentou a cota em 16,6 mil toneladas anuais para 96,5 mil, informou nesta quinta-feira a associação nacional do setor ABPA. Estas alterações […]",20/04/2023 21:21
economia,Voto de Barroso surpreendeu juristas ao não propor correção de valores passados do FGTS,"O voto do ministro Luís Roberto Barroso, relator da ação que discute a correção monetária do FGTS no Supremo Tribunal Federal (STF), causou surpresa em advogados que esperam algum tipo de modulação dos efeitos. Barroso defendeu que a remuneração do FGTS não deve ser menor que a da caderneta de poupança, e propôs que os […]",20/04/2023 20:55
economia,Petrobras fecha contrato para modernização e ampliação na refinaria Rnest,"Por Nayara Figueiredo SÃO PAULO (Reuters) – A Petrobras informou nesta quinta-feira que assinou contrato para ampliação e modernização de unidades já em operação na Refinaria Abreu e Lima (Rnest), em Pernambuco, com o objetivo de elevar a oferta de diesel ao país nos próximos anos, conforme comunicado. Após a conclusão das obras, esperada para […]",20/04/2023 20:31
economia,Grande explosão é reportada em cidade russa perto da fronteira com a Ucrânia,"(Reuters) – Uma grande explosão atingiu uma rua na cidade russa de Belgorod, que fica do outro lado da fronteira com a Ucrânia, na noite de quinta-feira, mas não houve relatos iniciais de feridos, disseram autoridades locais. O governador da região de Belgorod, Vyacheslav Gladkov, anunciou a imposição de estado de emergência e disse no […]",20/04/2023 20:19
economia,Grãos de Chicago fecham em baixa com dados de exportação mais fracos e clima favorável nos EUA,Por Cassandra Garrison (Reuters) – Os grãos de Chicago fecharam em baixa nesta quinta-feira com dados de vendas de exportação de soja dos EUA abaixo do esperado e clima favorável no país que permitiria a aceleração do plantio no cinturão agrícola do Meio-Oeste. Os preços dos grãos também foram impactados pela queda do petróleo bruto. […],20/04/2023 20:00
economia,Biodiesel acentua pressão no preço do diesel do Brasil já em queda por importações,"Por Marta Nogueira e Roberto Samora RIO DE JANEIRO/SÃO PAULO (Reuters) -Cotações mais baixas do biodiesel no Brasil estão ajudando a segurar os preços do diesel nos postos do país, que já vinham pressionados por importações do combustível mais barato, especialmente da Rússia, de acordo com analistas e uma associação de produtores ouvidos pela Reuters. […]",20/04/2023 18:47
economia,STF: Mendonça segue Barroso contra FGTS abaixo da poupança,"O ministro André Mendonça, do Supremo Tribunal Federal (STF), seguiu o relator, Luís Roberto Barroso, na ação que discute a correção monetária do FGTS. O entendimento dos ministros é que a correção dos valores vinculados ao fundo deve ser pelo menos igual à caderneta da poupança. Após o voto de Mendonça, o julgamento foi suspenso […]",20/04/2023 18:40
economia,Relator de ação sobre FGTS vota para que correção não seja inferior ao rendimento da poupança,"O ministro Luís Roberto Barroso, do Supremo Tribunal Federal (STF), relator de ação que pede a correção monetária do FGTS com base na inflação, proferiu um voto médio sobre o tema na sessão desta quinta-feira, 20. No entendimento do ministro, a correção monetária dos valores vinculados ao fundo deve ser pelo menos igual à caderneta […]",20/04/2023 18:38
economia,Chanceler russo vai a Havana em campanha para angariar apoio na América Latina,"Por Dave Sherwood HAVANA (Reuters) – O ministro das Relações Exteriores da Rússia, Sergei Lavrov, reuniu-se nesta quinta-feira com o presidente cubano, Miguel Díaz-Canel, e com o ministro das Relações Exteriores do país, Bruno Rodríguez, em Havana, na última de uma série de visitas para fortalecer o apoio entre os aliados mais próximos da Rússia […]",20/04/2023 18:31
economia,"Açúcar atinge máxima de 11 anos em NY, café recua após pico de 6 meses e meio","NOVA YORK/LONDRES (Reuters) – Os contratos futuros de açúcar bruto na ICE subiram para os preços mais altos desde março de 2012 nesta quinta-feira em meio ao aperto na oferta global, enquanto o café arábica recuou após atingir um pico de seis meses e meio no início desta semana. AÇÚCAR * O contrato maio do […]",20/04/2023 18:16
economia,"Argentina: BC aumenta juros básicos em 300 pontos-base, com inflação recorde em três décadas","O Banco Central da Argentina (BCRA) confirmou nesta quinta-feira, 20, o aumento dos juros básicos em 300 pontos-base, conforme havia sido antecipado por veículos da imprensa local. Com a decisão, a taxa da chamada Letra de Liquidez (Leliq) avança a 81%, após a inflação no país atingir o maior nível em três décadas. Segundo comunicado, […]",20/04/2023 18:10
economia,Prêmios de soja no Brasil despencam com safra recorde e demanda chinesa mais fraca,"Por Ana Mano SÃO PAULO (Reuters) – Os prêmios da soja brasileira nos portos caíram para mínimas históricas nos últimos dias em meio ao arrefecimento da demanda chinesa, enquanto o país colhe uma safra recorde, disseram analistas e traders. Os prêmios caíram para -200 pontos base por bushel esta semana em portos como Paranaguá para […]",20/04/2023 17:59
economia,Deputado diz que Câmara votará urgência do arcabouço e projeto deve ir direto ao plenário,"O relator do projeto de lei complementar (PL) do novo arcabouço fiscal, deputado Cláudio Cajado (PP-BA), confirmou nesta quinta-feira, 20, que a Câmara votará urgência no PL e o texto irá direto ao plenário da Casa. Ele também disse esperar que a matéria seja votada até a primeira quinzena de maio. A aprovação do rito […]",20/04/2023 17:53
economia,Haddad promete ao varejo plano para adequar compras de plataformas asiáticas,"O ministro da Fazenda, Fernando Haddad, prometeu nesta quinta-feira a empresários do varejo que vai trabalhar em um plano de adequação das compras feitas em lojas de comércio eletrônico asiáticas. Um dos objetivos é assegurar que o imposto seja cobrado na transação. Ao deixar a audiência com Haddad no gabinete do ministério da Fazenda em […]",20/04/2023 17:48
economia,"Dirigente do Fed repete que juros devem superar 5%, mas evita antecipar decisão de maio","A presidente do Federal Reserve (Fed, o banco central norte-americano) de Cleveland, Loretta Mester, reiterou nesta quinta-feira, 20, que os juros básicos devem superar 5%, mas não quis antecipar se defenderá uma elevação de 25 pontos-base no encontro de maio do Comitê Federal de Mercado Aberto (FOMC). A dirigente, que não vota nas reuniões deste […]",20/04/2023 17:44
economia,"EUA enviarão tropas ao Djibuti para eventual desocupação de embaixada no Sudão, diz autoridade","WASHINGTON (Reuters) – Os Estados Unidos estão se preparando para enviar um grande número de tropas adicionais para sua base em Djibuti no caso de uma eventual retirada de cidadãos norte-americanos do Sudão, disse uma autoridade norte-americana nesta quinta-feira, quando novos conflitos armados irromperam. O funcionário, falando sob condição de anonimato, se recusou a dar […]",20/04/2023 17:40
economia,"Colheita de soja 22/23 atinge 54% da área no RS, diz Emater; alerta para novos cortes","SÃO PAULO (Reuters) – A colheita de soja 2022/23 alcançou 54% das áreas cultivadas no Rio Grande do Sul, avanço semanal de 22 pontos percentuais, informou nesta quinta-feira a Emater-RS, sinalizando que ainda pode reduzir neste mês sua projeção sobre os rendimentos das lavouras, que foram afetadas anteriormente por uma seca. Em março, a empresa […]",20/04/2023 17:39
economia,BC defende uso da TR para corrigir FGTS; governo alega impacto na empregabilidade,"O procurador Erasto Villaverde Carvalho Filho, que representou o Banco Central no julgamento sobre a correção do Fundo de Garantia do Tempo de Serviço (FGTS) no Supremo Tribunal Federal (STF), defendeu a continuidade do uso da Taxa Referencial (TR) para a atualização dos valores vinculados ao fundo. O Banco Central é a instituição responsável por […]",20/04/2023 17:34
economia,Shein anuncia que vai fabricar roupas no Brasil e prevê investir R$ 750 mi no País,"A varejista de moda chinesa Shein anunciou nesta quinta-feira, 20, que vai começar a fabricar suas roupas no Brasil, em um investimento que pode gerar 100 mil empregos em três anos. Inicialmente, deve gastar R$ 750 milhões para fornecer tecnologias e treinamento a fabricantes têxteis brasileiros. O anúncio acontece em meio a pressão de concorrentes […]",20/04/2023 17:21
economia,DeSantis assina projeto de lei para facilitar aplicação de pena de morte na Flórida,"Por Tyler Clifford (Reuters) – O governador da Flórida, Ron DeSantis, assinou um projeto de lei nesta quinta-feira encerrando uma exigência de que os júris precisam votar por unanimidade para recomendar a pena de morte antes que um juiz em um julgamento de crime capital possa sentenciar um réu à morte. O governador republicano, que […]",20/04/2023 15:57
economia,Justiça determina que MST desocupe fazenda da Embrapa em Pernambuco,"A Justiça Federal em Pernambuco determinou que o Movimento dos Trabalhadores Rurais Sem Terra (MST) desocupe uma fazenda pertencente à Empresa Brasileira de Pesquisa Agropecuária (Embrapa), localizada em Petrolina (PE). Em sua decisão, desta quarta-feira (19), a juíza federal Danielli Farias Rabelo Leitão Rodrigues estabelece que os cerca de 600 integrantes do movimento que estão na propriedade […]",20/04/2023 15:49
economia,"Fed está mais perto que do que longe, diz dirigente, sobre fim do ciclo de aperto monetário","A presidente do Federal Reserve (Fed, o banco central norte-americano) de Cleveland, Loretta Mester, disse que o banco central está mais perto do que longe de chegar ao fim do ciclo de aperto monetário. “O Fed percorreu um longo caminho no aperto à política monetária”, declarou, em coletiva de imprensa nesta quinta. Loretta Mester disse […]",20/04/2023 15:44
economia,Opas inicia negociações com farmacêutica Takeda sobre preços de vacinas contra a dengue,"(Reuters) – A Organização Pan-Americana da Saúde (Opas) está em negociações preliminares com a farmacêutica japonesa Takeda sobre possíveis encomendas de sua vacina contra a dengue, disse o diretor da organização nesta quinta-feira, embora a instituição ainda não tenha decidido se recomendará o imunizante. “Os dados são realmente muito impressionantes”, disse o diretor da Opas, Jarbas […]",20/04/2023 15:41
economia,Rabobank reduz safra de café do Brasil após corte na previsão para arábica,"Por Roberto Samora SÃO PAULO (Reuters) – A safra de café do Brasil na temporada 2023/24 foi estimada em 66 milhões de sacas de 60 kg, com um corte de 1,1 milhão de sacas ante a previsão anterior, após expectativa de menores produtividades em áreas de arábica de Minas Gerais, afirmou o Rabobank nesta quinta-feira. […]",20/04/2023 15:35
economia,"IGC eleva projeção da safra global 2022/23 de grãos, para 2,252 bilhões de toneladas","O Conselho Internacional de Grãos (IGC, na sigla em inglês) aumentou sua previsão de produção global de grãos na temporada 2022/23, para 2,252 bilhões de toneladas, ante 2,250 bilhões de toneladas da previsão divulgada em março, principalmente por causa da expectativa de aumento da produção de trigo, justificou o IGC. No entanto, caso confirmado, o […]",20/04/2023 15:18
economia,"Banco Inter pede que funcionários evitem cabelo sem corte, chulé, bolsa velha e roupa amassada","Telefone celular com capinha velha, acessórios sujos ou estragados, chulé e cabelo desarrumado. Esses são alguns dos itens listados pelo Banco Inter em cartilha compartilhada com funcionários que traz “dicas” de estilo e comportamento sugeridas durante o expediente. O documento, intitulado de “os inimigos da imagem”, reúne 14 normas para serem evitadas “a todo custo”. […]",20/04/2023 15:13
economia,BC pede projeções mensais de núcleos e de fiscal de longo prazo em pesquisa pré-Copom,"O Banco Central (BC) pediu projeções mensais de núcleos de inflação e estimativas fiscais de longo prazo na pesquisa pré-Copom de maio. O encontro será nos dias 2 e 3 do mês que vem. Na quarta-feira, 19, o presidente do BC, Roberto Campos Neto, afirmou que a inflação brasileira tem diminuído, mas que os núcleos, […]",20/04/2023 14:40
economia,Haddad diz que Shein pretende nacionalizar 85% das vendas nos próximos anos,"O ministro da Fazenda, Fernando Haddad, afirmou nesta quinta-feira, 20, que a e-commerce chinesa Shein pretende nacionalizar 85% de suas vendas em quatro anos, com produtos feitos no Brasil. O anúncio deve ser feito ainda nesta quinta pela Shein, adiantou o ministro, que se reuniu com a empresa no período da manhã. “Eles próprios vão […]",20/04/2023 14:36
economia,Fazenda anuncia medidas para desburocratizar concessão de crédito,"O secretário de Reformas Econômicas do Ministério da Fazenda, Marcos Barbosa Pinto, anunciou nesta quinta-feira, 20, medidas para desburocratizar a concessão de crédito, com a dispensa de documentos, além de simplificar o processo para a emissão de debêntures. “Estamos simplificando bastante o processo de emissão das debêntures. A lei criou procedimentos burocráticos”, disse Pinto, segundo […]",20/04/2023 14:22
economia,Publicação digital BuzzFeed News vai encerrar suas atividades nos EUA,"A publicação digital BuzzFeed News, símbolo da nova imprensa na Internet, vai encerrar suas atividades, no âmbito de um plano de ajustes, anunciou o diretor da BuzzFeed, Jonah Peretti, nesta quinta-feira (20), em uma nota interna, à qual a AFP teve acesso. “Estamos reduzindo nosso quadro de funcionários em cerca de 15% hoje… e iniciando […]",20/04/2023 14:15
economia,"Vendas de café do Brasil ganham ritmo com início da colheita e preços melhores, diz Safras","SÃO PAULO (Reuters) – As vendas de café brasileiro do ciclo 2023/24 ganharam ritmo com o início da colheita de grãos conilon e pela alta nos preços, apontou nesta quinta-feira a consultoria Safras & Mercado, estimando que os produtores tinham vendido 23% do potencial da produção nacional até o último dia 17 de abril. Em […]",20/04/2023 13:58
economia,Dirigente do Fed prevê juros em nível superior a 5% por algum tempo nos EUA,"A presidente da distrital do Federal Reserve (Fed, o banco central norte-americano) em Cleveland, Loretta Mester, afirmou, nesta quinta-feira, 20, que a autoridade monetária terá que aumentar juros ao pico superior a 5% e mantê-lo nesse nível por algum tempo. Atualmente, a taxa básica está na faixa entre 4,75% e 5,00%. Em discurso em Ohio, […]",20/04/2023 13:58
economia,"Haddad sobre e-commerce: governo seguirá países desenvolvidos, com imposto digital à empresa","O ministro da Fazenda, Fernando Haddad, afirmou nesta quinta-feira, 20, que o governo pretende solucionar a questão da taxação do e-commerce seguindo o exemplo de países desenvolvidos, com um imposto digital. O ministro também disse que a alternativa atende a sinalização do presidente da República, Luiz Inácio Lula da Silva, que pediu uma solução administrativa […]",20/04/2023 13:38
economia,"Shein vai nacionalizar 85% das vendas em 4 anos com produção no Brasil, diz Haddad","(Reuters) – O ministro da Fazenda, Fernando Haddad, disse nesta quinta-feira que a empresa de comércio eletrônico chinesa Shein vai nacionalizar 85% das vendas no país em quatro anos, com produção de bens passando a ser feita no Brasil. A Shein também se comprometeu, em reunião de executivos da empresa com o ministro nesta manhã, […]",20/04/2023 13:30
economia,"Crédito imobiliário do SBPE sobe 17,6% em 1 ano e atinge R$ 17,4 bi em março, diz Abecip","Os financiamentos imobiliários com recursos das cadernetas do Sistema Brasileiro de Poupança e Empréstimo (SBPE) somaram R$ 17,4 bilhões em março de 2023, um aumento de 17,6% ante o registrado um ano antes. Na comparação com fevereiro, o crescimento foi de 66,4%, informou a Associação Brasileira das Entidades de Crédito Imobiliário e Poupança (Abecip). No […]",20/04/2023 13:27
economia,"Relator do PL do arcabouço fiscal será deputado Cláudio Cajado, do PP, anuncia Lira","Por Ricardo Brito BRASÍLIA (Reuters) – O relator do projeto de lei complementar que trata da nova regra fiscal para o país será o deputado Cláudio Cajado, do PP da Bahia, anunciou o presidente da Câmara, Arthur Lira (PP-AL), em sua conta no Twitter. “Com a celeridade que o país exige, informo que o relator […]",20/04/2023 13:12
economia,Fazenda tem 153 projetos de PPPs no radar e vê interesse de bancos no modelo de garantia,"O Ministério da Fazenda calcula que existam 153 projetos de Parcerias Público-Privadas (PPPs) em fase de estruturação ou licitação pelo País. O governo federal vai passar a apoiar essas modelagens de Estados e municípios por meio de operações com garantia do Tesouro Nacional. Basicamente, a garantia poderá ser usada em aportes feitos nas PPPs para […]",20/04/2023 12:52
economia,Presidente de Uganda consulta parlamentares sobre projeto de lei anti-LGBTQ,"KAMPALA (Reuters) – O presidente de Uganda, Yoweri Museveni, se reuniu com parlamentares de seu partido nesta quinta-feira para discutir um projeto de lei anti-LGBTQ rígido antes do prazo para sancionar, vetar ou enviar a medida de volta ao Parlamento para revisões. Ativistas de direitos humanos e o governo dos Estados Unidos dizem que o […]",20/04/2023 12:48
economia,França quer restrição a produtos de áreas desmatadas no acordo UE-Mercosul,A negociação para um acordo comercial entre União Europeia (UE) e Mercosul deve levar em consideração a lei contra a importação de produtos de áreas desmatadas aprovada pelo Parlamento Europeu na quarta-feira (19) – afirmou a França nesta quinta (20). “Todos os acordos comerciais da União Europeia devem levar em consideração o respeito das normas […],20/04/2023 12:45
economia,Eletrobras propõe aporte de R$ 4 bi para adiantar dívidas de Santo Antônio Energia com bancos,"Em meio aos esforços da Eletrobras para capitalizar e reestruturar as dívidas de sua controlada indireta Santo Antônio Energia, responsável pela hidrelétrica de mesmo nome, a companhia planeja realizar uma operação envolvendo um aporte financeiro de R$ 4 bilhões para o pré-pagamento de dívidas e assumir o débito restante junto ao Banco Nacional de Desenvolvimento […]",20/04/2023 12:44
economia,STF julga ação que pode flexibilizar fim da contribuição sindical obrigatória,"O Supremo Tribunal Federal (STF) julga em plenário virtual, até a próxima segunda-feira, 24, se todos os empregados, sindicalizados ou não, são obrigados a pagar contribuição assistencial prevista em acordo coletivo. Os ministros julgam recurso de entidades sindicais contra decisão da Corte de 2017 que determinou que essa obrigação abrange apenas funcionários filiados ao sindicato […]",20/04/2023 12:35
economia,Advogados do ex-presidente peruano Toledo tentam impedir extradição nos EUA,"WASHINGTON (Reuters) – Advogados do ex-presidente peruano Alejandro Toledo entraram com pedido de estadia emergencial em um tribunal federal dos Estados Unidos nesta quinta-feira para impedir sua extradição ao Peru, onde ele enfrenta acusações de corrupção. Os advogados argumentaram no início da manhã que a suspensão de sua detenção e extradição é “necessária para evitar […]",20/04/2023 12:32
economia,Biden anuncia US$ 500 milhões para Fundo Amazônia nos próximos 5 anos,"Por Lisandra Paraguassu e Jeff Mason BRASÍLIA/WASHINGTON (Reuters) – O presidente dos Estados Unidos, Joe Biden, anunciou nesta quinta-feira que pretende aplicar 500 milhões de dólares no Fundo Amazônia nos próximos cinco anos, durante o Fórum Virtual de Grandes Economias sobre Clima e Energia, do qual o Brasil participa. Um funcionário de alto escalão do […]",20/04/2023 12:29
economia,"Vendas de moradias usadas nos EUA caem 2,4% em março ante fevereiro","As vendas de moradias usadas nos Estados Unidos recuaram 2,4% em entre fevereiro e março, para uma taxa anual ajustada sazonalmente 4,44 milhões, informou nesta quinta-feira, 20, a Associação Nacional de Corretoras (NAR, na sigla em inglês). Analistas ouvidos pelo Wall Street Journal previam queda menor, de 2,0%, ao nível de 4,49 milhões. Fonte: Dow […]",20/04/2023 12:23
negocios,Wall St registra leve ganho antes de semana de resultados importantes,"Por Lewis Krauskopf e Sruthi Shankar e Ankika Biswas (Reuters) – Os principais índices de ações dos Estados Unidos fecharam com ganhos mínimos nesta sexta-feira, após resultados trimestrais mistos, com os investidores avaliando como dados econômicos conflitantes podem influenciar as taxas de juros e antecipando uma semana cheia de relatórios corporativos. Uma pesquisa mostrou nesta […]",21/04/2023 18:36
negocios,Epic Games anuncia compra do estúdio brasileiro Aquiris,"A desenvolvedora de jogos Epic Games anunciou nesta quarta-feira (19) a compra do estúdio brasileiro Aquiris, que já havia recebido investimentos da empresa no início de 2022. Como resultado da aquisição, a Aquiris passará a se chamar Epic Games Brasil, o primeiro estúdio da Epic na América Latina. Fundada em 2007, a Aquiris se tornou […]",21/04/2023 17:20
negocios,"Reguladores financeiros dos EUA vão endurecer regras sobre empresas não bancárias, avaliação de risco","Por David Lawder WASHINGTON (Reuters) – O Conselho de Supervisão de Estabilidade Financeira (FSOC, na sigla em inglês) propôs nesta sexta-feira diretrizes para facilitar a designação de instituições financeiras não bancárias para supervisão regulatória e novos procedimentos para melhor identificar e responder aos riscos do sistema financeiro. O conselho multirregulador encarregado de supervisionar os riscos […]",21/04/2023 17:01
negocios,Autoridade de sanções dos EUA discute atuação do banco austríaco Raiffeisen na Rússia,"VIENA (Reuters) – Um alto funcionário de sanções dos Estados Unidos teve uma reunião com o Raiffeisen Bank International em Viena, esta semana, para discutir os negócios do banco na Rússia e enfatizou a importância de manter os canais de pagamento abertos para algumas transações, disseram os Estados Unidos nesta sexta-feira. O RBI RBIV.VI da […]",21/04/2023 16:10
negocios,Credit Suisse: investidores questionam cancelamento de US$ 17 bilhões em bônus,"Detentores de bônus do Credit Suisse iniciaram um processo legal na Suíça questionando a decisão de reguladores de dar baixa contábil em US$ 17 bilhões em dívida, como parte da aquisição do banco pelo UBS no mês passado. Investidores que detêm cerca de 4,5 bilhões em francos suíços da dívida cancelada do Credit Suisse querem […]",21/04/2023 15:36
negocios,Júri da Califórnia conclui que sistema de direção autônoma da Tesla não falhou em acidente,"Por Hyunjoo Jin e Dan Levine e Abhirup Roy LOS ANGELES (Reuters) – O júri de um tribunal estadual da Califórnia concedeu na sexta-feira uma vitória esmagadora à Tesla Inc TSLA.O, concluindo que o recurso de direção autônoma da montadora não falhou em funcionar com segurança no que parece ser o primeiro julgamento relacionado a […]",21/04/2023 15:31
negocios,"JHSF: vendas em incorporação recuam 25,7% no 1º trimestre e somam R$ 239,1 milhões","A JHSF divulgou nesta sexta-feira, 21, a prévia operacional do primeiro trimestre de 2023, quando as vendas contratadas no segmento de incorporação recuaram 25,7% em relação às realizadas mesmo período do ano anterior, e somaram R$ 239,1 milhões. As vendas consolidadas dos shoppings da companhia cresceram 14,7% de janeiro a março ante igual etapa de […]",21/04/2023 15:31
negocios,Coteminas anuncia parceria com a Shein para produção no Brasil,A Companhia de Tecidos Norte de Minas (Coteminas) anunciou a assinatura de um memorando de entendimentos com a Shein. O memorando prevê que 2 mil dos clientes confeccionistas da empresa passem a ser fornecedores da Shein para atender os mercados doméstico e da América Latina. A parceria também abrange o financiamento para capital de trabalho […],21/04/2023 15:08
negocios,"EUA compram soja brasileira após queda de preço, mostram dados de agência marítima","Por Ana Mano SÃO PAULO (Reuters) – Uma queda nos preços da soja brasileira aumentou a atratividade da oleaginosa nacional, com pelo menos dois navios transportando um total de 79.150 toneladas do produto para os Estados Unidos nos próximos dias, de acordo com os dados de uma agência marítima. O CS Satira, afretado pela The […]",21/04/2023 14:57
