Secao,Titulo,Descrição,Data
economia,"Biden prometerá medidas para dissuadir ataques nucleares contra a Coreia do Sul, dizem autoridades","Por Steve Holland e David Brunnstrom WASHINGTON (Reuters) – Em uma cúpula na próxima semana com o líder sul-coreano, Yoon Suk Yeol, o presidente norte-americano, Joe Biden, prometerá medidas “substanciais” para sublinhar o comprometimento dos EUA para dissuadir ataques nucleares da Coreia do Norte contra a Coreia do Sul, disse uma autoridade norte-americana nesta sexta-feira. […]",21/04/2023 21:07
economia,"BCE/Guindos: núcleo da inflação também baixará, mesmo que esteja mais ‘pegajoso’","O vice-presidente do Banco Central Europeu (BCE), Luis de Guindos, afirmou nesta sexta-feira, 21, que o núcleo da inflação na zona do euro, que exclui itens voláteis como alimentos e energia, ainda baixará, embora esteja mais “pegajoso” que o índice cheio. A declaração foi dada durante evento em Madri, no qual ele disse que os […]",21/04/2023 19:31
economia,Investigação sobre chefe da OEA atrai pressão de membros por reformas éticas,"Por Matt Spetalnick WASHINGTON (Reuters) – A Organização dos Estados Americanos aprovou uma resolução nesta sexta-feira por um plano para atualizar seu código de regras e ética, em resposta a uma investigação externa que concluiu que o chefe da entidade exibiu falta de sensatez, mas não cometeu uma má conduta séria ao manter uma relação […]",21/04/2023 19:02
economia,"Para diretora do Fed, caminho da inflação de volta a 2% nos EUA será longo","Diretora do Federal Reserve (Fed, o banco central americano), Lisa Cook afirmou que existem indícios de que o caminho da inflação de volta a 2% nos Estados Unidos será longo. “Se os dados mostrarem força contínua na economia e desinflação mais lenta, podemos ter mais trabalho a fazer”, observou, durante evento da Universidade de Georgetown. […]",21/04/2023 18:48
economia,S&P revisa perspectiva de ratings soberanos do Reino Unido de negativa para estável,"A S&P Global Ratings revisou nesta sexta-feira, 21, a perspectiva do crédito soberano do Reino Unido de negativa para estável, diante da percepção de que os riscos de curto prazo à economia britânica arrefeceram. Ainda assim, a agência prevê uma contração “modesta” do Produto Interno Bruto (PIB) do país este ano, de 0,5%. A instituição […]",21/04/2023 18:33
economia,"S&P reafirma rating ‘BBB/A-2’ da Itália, com perspectiva estável","A S&P reafirmou nesta sexta-feira, 21, o rating ‘BBB/A-2’ da Itália, com perspectiva estável. A agência de classificação de risco projeta que a taxa de dívida pública em relação ao Produto Interno Bruto (PIB) do país deve reduzir nos próximos três anos, tendo em vista uma aceleração do crescimento no próximo ano em razão dos […]",21/04/2023 18:25
economia,Biden assina decreto sobre “justiça ambiental”,"Por Steve Holland WASHINGTON (Reuters) – O presidente norte-americano, Joe Biden, assinou um decreto nesta sexta-feira determinando que todas as agências federais trabalhem por “justiça ambiental para todos” e melhorem as vidas das comunidades mais atingidas pela poluição tóxica e pelas mudanças climáticas. O decreto estabelecerá o Gabinete de Justiça Ambiental dentro da Casa Branca […]",21/04/2023 17:58
economia,"Conflitos em Cartum não diminuem, após Exército do Sudão declarar trégua","Por Khalid Abdelaziz e Nafisa Eltahir CARTUM (Reuters) – Pesados tiroteios foram ouvidos em Cartum nesta sexta-feira, após o Exército do Sudão declarar uma trégua, disse uma testemunha da Reuters, um golpe às tentativas internacionais de encerrar quase uma semana de conflitos entre suas tropas e uma força rival. A origem dos tiros não ficou […]",21/04/2023 17:26
economia,"Cepal prevê menor crescimento na AL e Caribe, 1,2% em 2023; Brasil deve avançar 0,8%","A Comissão Econômica para a América Latina e o Caribe (Cepal), ligada à Organização das Nações Unidas (ONU), espera desaceleração do crescimento econômico na América Latina e no Caribe em 2023, com um avanço de 1,2% no ano. Para o Brasil, a perspectiva é de alta de 0,8% do Produto Interno Bruto (PIB). O menor […]",21/04/2023 17:21
economia,"México capta US$ 2,9 bi no mercado internacional, segunda emissão externa do país em 2023","O México captou US$ 2,94 bilhões no mercado internacional esta semana e vai usar parte do dinheiro para recomprar títulos emitidos no passado. A demanda pelos papéis superou US$ 11 bilhões, segundo fontes que acompanharam a operação, a única da América Latina esta semana no mercado internacional. Os papéis têm vencimento em 2053 e com […]",21/04/2023 17:19
economia,"Tribunal da Rússia ordena prisão à revelia de repórter búlgaro, diz agência RIA","(Reuters) – Um tribunal de Moscou ordenou nesta sexta-feira a prisão à revelia do jornalista investigativo búlgaro, Christo Grozev, cujo trabalho para o site Bellingcat irritou a Rússia, disse a agência de notícias RIA. O tribunal disse que Grozev cruzou ilegalmente a fronteira russa. A RIA citou uma fonte policial dizendo que Grozev foi acusado […]",21/04/2023 16:51
economia,Poluição e gripe aviária ameaçam a “muito frágil” população de golfinhos-chilenos,"SANTIAGO (Reuters) – Poluição cada vez maior, atividades industriais e agora a gripe aviária estão ameaçando os golfinhos-chilenos, um dos menores cetáceos do mundo, nas águas frias do Oceano Pacífico na costa oeste do Chile. A baixa população do golfinhos, também conhecidos como “tonina negra”, vive nas costas sul e central do Chile, em baías […]",21/04/2023 16:37
economia,Aliados trabalham para aumentar forças de tanques da Ucrânia antes de contra-ofensiva,"BASE AÉREA RAMSTEIN, Alemanha (Reuters) – Os Estados Unidos disseram que em breve começarão a treinar tropas ucranianas para usar seus tanques Abrams, e a Alemanha anunciou um acordo para organizar um centro de reparo de tanques na Polônia, com os EUA sediando uma reunião de aliados nesta sexta-feira.   A reunião na base aérea […]",21/04/2023 16:29
economia,Brasil está prestes a se tornar o maior exportador de milho do mundo,"Em sua fazenda em Sinop, no Mato Grosso, o produtor rural Ilson José Redivo terminou o plantio de milho há algumas semanas, imediatamente depois da colheita de soja no mesmo terreno. A “safrinha”, que começou nos anos 1980 como um cultivo secundário, superou há uma década a colheita de verão e, graças a ela, espera-se […]",21/04/2023 15:54
economia,Reino Unido quer mudar lei para acelerar deportação de imigrantes ilegais,"Por David Milliken LONDRES (Reuters) – O governo do Reino Unido informou nesta sexta-feira que estabelecerá medidas para limitar a capacidade dos tribunais de bloquear a deportação de imigrantes ilegais, como parte de mudanças na legislação proposta que será submetida ao Parlamento na próxima semana. Interromper o fluxo de requerentes de asilo e outros migrantes […]",21/04/2023 15:41
economia,Credit Suisse: investidores questionam cancelamento de US$ 17 bilhões em bônus,"Detentores de bônus do Credit Suisse iniciaram um processo legal na Suíça questionando a decisão de reguladores de dar baixa contábil em US$ 17 bilhões em dívida, como parte da aquisição do banco pelo UBS no mês passado. Investidores que detêm cerca de 4,5 bilhões em francos suíços da dívida cancelada do Credit Suisse querem […]",21/04/2023 15:36
economia,Bolívia: Congresso avalia projeto de lei para ampliar reservas de moeda estrangeira,"A Assembleia Legislativa boliviana, controlada pelo partido governista, iniciou nesta sexta-feira, 21, a tramitação de um projeto de lei que busca fortalecer as reservas internacionais após a queda das receitas. No início da sessão, houve disputas entre deputados governistas e opositores sobre o tratamento dado à iniciativa promovida pelo governo do presidente esquerdista Luis Arce. […]",21/04/2023 15:32
economia,Ex-presidente do Peru Toledo se rende às autoridades dos EUA,"(Reuters) – O ex-presidente peruano Alejandro Toledo se entregou às autoridades dos Estados Unidos nesta sexta-feira, disse um representante do US Marshals Service à Reuters, um dia depois que sua tentativa de bloquear sua extradição para o Peru por acusações de corrupção foi negada. Toledo, que foi presidente de 2001 a 2006, é procurado no […]",21/04/2023 15:08
economia,Coteminas anuncia parceria com a Shein para produção no Brasil,A Companhia de Tecidos Norte de Minas (Coteminas) anunciou a assinatura de um memorando de entendimentos com a Shein. O memorando prevê que 2 mil dos clientes confeccionistas da empresa passem a ser fornecedores da Shein para atender os mercados doméstico e da América Latina. A parceria também abrange o financiamento para capital de trabalho […],21/04/2023 15:08
economia,IFF/Brooks: Real está depreciado considerando superávit crescente sustentado pela agricultura,"O economista-chefe do Instituto de Finanças Internacionais (IIF, na sigla em inglês), Robin Brooks, reiterou nesta sexta-feira, 21, em seu perfil no Twitter que o real brasileiro está desvalorizado ante o dólar, tendo em vista que o superávit comercial do Brasil vem subindo sustentado por exportações de produtos agrícolas. “O superávit comercial do Brasil vem […]",21/04/2023 14:29
economia,Vice-primeiro-ministro britânico renuncia por conta de inquérito sobre bullying,"Por Andrew MacAskill e Alistair Smout e Sachin Ravikumar LONDRES (Reuters) – O vice-primeiro-ministro britânico Dominic Raab renunciou nesta sexta-feira depois que um relatório independente concluiu que ele havia intimidado autoridades, o mais recente escândalo a forçar a saída de um dos principais membros do gabinete do primeiro-ministro Rishi Sunak. A perda de um terceiro […]",21/04/2023 14:01
economia,"Twitter retira rótulo de “financiado pelo governo” de contas de mídia, inclusive da China","(Reuters) – O Twitter retirou os rótulos de “financiado pelo governo” e “afiliado do Estado da China”, que designavam envolvimento do governo no conteúdo editorial, das contas de várias organizações globais de mídia, mostraram seus perfis nesta sexta-feira. O Twitter retirou o rótulo “Mídia financiada pelo governo” das contas da National Public Radio (NPR), dos […]",21/04/2023 13:53
economia,Canadá promete quase US$ 10 bilhões à Volkswagen para fábrica de baterias elétricas,"O governo canadense concederá subsídios de até 13,2 bilhões de dólares canadenses (9,8 bilhões de dólares americanos, 49,4 bilhões de reais na cotação atual) ao longo de dez anos à montadora alemã Volkswagen para a construção de sua primeira fábrica de baterias elétricas fora da Europa, no Canadá. “O investimento dependerá da quantidade de baterias […]",21/04/2023 13:44
economia,"BCE: é preciso cautela e definir juros a cada reunião, com base em novos dados, afirma Visco","Dirigente do Banco Central Europeu (BCE), Ignazio Visco disse nesta sexta-feira, dia 21, que o banco precisa ser cauteloso na definição de sua política monetária e tomar decisões a cada reunião. Em entrevista à Bloomberg TV, Visco, que também é presidente do BC italiano, afirmou que o BCE irá manter a postura de decidir sobre […]",21/04/2023 13:06
economia,Chile anuncia plano para nacionalizar produção de lítio,"O presidente do Chile, Gabriel Boric, anunciou um plano nesta quinta-feira, 20, para exigir que empresas privadas aceitem o governo do Chile como parceiro na extração de lítio, que tem alta demanda em todo o mundo para uso em baterias elétricas. Boric afirmou que o Estado participará de todo o ciclo de produção de lítio […]",21/04/2023 12:48
economia,"Rússia atenta a novas sanções ocidentais, e diz que elas atingiriam a economia mundial","(Reuters) – O Kremlin disse nesta sexta-feira que está monitorando relatos de uma possível proibição de exportações para a Rússia por países ocidentais, e que novas sanções prejudicariam a economia global. “Estamos monitorando cuidadosamente isso, estamos cientes de que tanto os EUA quanto a UE estão considerando ativamente novas sanções”, disse o porta-voz do Kremlin, […]",21/04/2023 11:59
economia,"Capital do Sudão tem novos conflitos armados em feriado muçulmano, exército avança a pé","Por Khalid Abdelaziz Nafisa Eltahir CARTUM (Reuters) – Tiroteios atingiram bairros residenciais da capital do Sudão, Cartum, no início do feriado muçulmano de Eid al Fitr nesta sexta-feira, depois que o exército se posicionou a pé pela primeira vez em sua luta de quase uma semana contra uma  força paramilitar. Soldados e homens armados das […]",21/04/2023 11:51
economia,Alemanha anuncia acordo para consertar tanques para a Ucrânia em hub na Polônia,"(Reuters) – Alemanha, Polônia e Ucrânia assinaram um acordo nesta sexta-feira para criar um centro de reparos de tanques Leopard usados na Ucrânia para combater forças russas, disse o ministro da Defesa da Alemanha, Boris Pistorius, em uma reunião de aliados na base aérea de Ramstein. Todas as partes concordaram em como financiar tal hub, […]",21/04/2023 11:50
economia,"BCE não deve abandonar política monetária restritiva de modo prematuro, diz Olli Rehn","Integrante do conselho do Banco Central Europeu (BCE), Olli Rehn defendeu nesta sexta-feira, 21, que a instituição “não abandone” nem “saia de modo prematuro” da política monetária mais restritiva atual. Em ambiente de incerteza, ele disse ser “ainda mais importante que o normal” que as decisões de política monetária levem em conta a trajetória esperada […]",21/04/2023 11:49
economia,Oleoduto Cano Limon-Covenas da Colômbia é atacado pela nona vez neste ano,"BOGOTÁ (Reuters) – A suspensão das operações de bombeamento no oleoduto Cano Limon-Covenas, na Colômbia, será prolongada depois que um novo ataque a bomba danificou sua infraestrutura na província de Arauca, disse a empresa de transporte de petróleo Cenit. O ataque, o nono neste ano, ocorreu na quinta-feira no município de Saravena, levando a empresa […]",21/04/2023 11:18
economia,"Ucrânia tenta desbloquear acordo para embarque de grãos, mas Rússia ainda não aceita acordo","Por Luiza Ilie e Pavel Polityuk BUCARESTE/KIEV (Reuters) – As perspectivas da Ucrânia de desbloquear os embarques de grãos para a Europa Oriental melhoraram nesta sexta-feira, com a Romênia optando por não proibir unilateralmente as importações de alimentos, mas não houve progresso na extensão do acordo sobre as exportações do Mar Negro. O ministro das […]",21/04/2023 11:10
economia,"PMI composto (preliminar) dos EUA  sobe a 53,5 em abril, diz S&P Global","O índice de gerentes de compras (PMI, na sigla em inglês) composto dos Estados Unidos teve alta, de 52,3 em março a 53,5 na preliminar de abril, informou nesta sexta-feira, 21, a S&P Global, na máxima em 11 meses. Apena na indústria americana, o PMI avançou de 49,2 em março a 50,4 na prévia de […]",21/04/2023 11:02
economia,"Pacheco diz que arcabouço será aprovado, mas sugere que podem ser feitas mudanças","O presidente do Senado, Rodrigo Pacheco (PSD-MG), afirmou que o projeto do novo arcabouço fiscal encaminhado pelo governo ao Congresso está bem estruturado e que “será aprovado”. Em entrevista à CNN Brasil, o presidente do Senado disse que a essência do projeto agradou a maioria do Senado, mas disse, sem dar mais detalhes, que “eventuais […]",21/04/2023 10:28
economia,Alberto Fernández anuncia que não tentará reeleição na Argentina,"BUENOS AIRES (Reuters) – O presidente da Argentina, Alberto Fernández, anunciou nesta sexta-feira que desistiu de sua candidatura à reeleição nas eleições presidenciais de outubro. O anúncio foi feito numa mensagem publicada nas redes sociais, onde indicou que “entregará a faixa presidencial a quem tiver sido legitimamente eleito nas urnas pelo voto popular.” “Vou trabalhar […]",21/04/2023 10:25
economia,Suprema Corte dos EUA decide nesta sexta sobre pílulas abortivas,"Por Andrew Chung WASHINGTON (Reuters) – A Suprema Corte dos Estados Unidos está pronta para decidir se a pílula abortiva mifepristona continuará amplamente disponível no país, enquanto o país analisa uma oferta do governo do presidente democrata Joe Biden para defender a droga em um desafio à sua aprovação regulatória por grupos antiaborto. O tribunal […]",21/04/2023 10:19
economia,"‘Economia não gira em torno da Selic’, reforça Campos Neto em defesa da taxa de juros","O presidente do Banco Central (BC), Roberto Campos Neto, disse nesta sexta-feira, 21, que a economia não gira em torno da Selic. Ao ouvir de um empresário na Lide Brazil Conference que o elevado patamar da taxa de juros atrapalha o Brasil a crescer, Campos Neto respondeu que só 20% do crédito é ligado à […]",21/04/2023 10:07
economia,"Ritmo de aumento do nível do mar global dobrou, aponta relatório climático da ONU","Por Emma Farge GENEBRA (Reuters) – O nível global do mar está subindo mais do que o dobro do ritmo registrado na primeira década de medições, entre 1993 e 2002, e atingiu um novo recorde no ano passado, informou a Organização Meteorológica Mundial na sexta-feira, alertando que a tendência continuará por milênios. O degelo extremo […]",21/04/2023 09:58
economia,"Instalação da CPMI definitivamente não atrasa arcabouço fiscal, diz Pacheco","O presidente do Senado, Rodrigo Pacheco (PSD-MG), negou que a provável instalação da Comissão Parlamentar Mista de Inquérito (CPMI) sobre os atos golpistas de 8 de janeiro prejudique a tramitação do arcabouço fiscal ou da reforma tributária no Congresso. Pacheco afirmou que o requerimento para a instalação da CPMI será lido no plenário do Congresso […]",21/04/2023 09:58
economia,Campos Neto fala em Londres que BC trabalha em projeto para gerar avanço na indústria de fundos,"O presidente do Banco Central (BC), Roberto Campos Neto, disse nesta sexta-feira, 21, que a autoridade monetária está trabalhando em um projeto que visa a um avanço na indústria de fundos, como foi feito na indústria bancária. O banqueiro central fez essa afirmação ao responder uma pergunta da ex-ministra da Agricultura do governo Dilma, a […]",21/04/2023 09:51
economia,Campos Neto reforça ocorrência de inflação de demanda justificando atual patamar da Selic,"O presidente do Banco Central (BC), Roberto Campos Neto, reforçou nesta sexta-feira, 21, que há inflação de demanda no Brasil justificando o atual patamar da Selic. A situação fiscal do Pais é outro elemento entre as justificativas dos juros a 13,75% ao ano, segundo Campos Neto. O banqueiro central participou nesta sexta da Lide Brazil […]",21/04/2023 09:32
economia,Por que Lula escolheu Portugal e Espanha na primeira ida à Europa?,"Em sua primeira viagem oficial ao continente europeu neste mandato, presidente brasileiro irá somente à Península Ibérica, sem passar pelas potências Alemanha e França ou pela sede da UE, Bruxelas.",21/04/2023 09:31
economia,Campos Neto: BC sempre atuou de forma autônoma e elevou juro em ano de eleição presidencial,"O presidente do Banco Central (BC), Roberto Campos Neto, voltou mais uma vez a defender a autonomia da autoridade monetária. Durante participação no evento Lide Brazil Conference London, Campos Neto destacou que o timing da política monetária é diferente do timing da política e que é por isso que se faz necessária a autonomia formal […]",21/04/2023 09:10
economia,Rodrigo Pacheco volta a se dirigir a Campos Neto em Londres para pedir redução da taxa Selic,"O presidente do Senado Brasileiro, Rodrigo Pacheco (PSD-MG), voltou nesta sexta-feira, 21, a se dirigir ao presidente do Banco Central, Roberto Campos Neto, e pedir a redução da taxa básica de juros brasileira. Pacheco fez o pedido no seu discurso de abertura do segundo e último dia do evento Lide Brazil Conference London na capital […]",21/04/2023 09:07
economia,"PMI composto do Reino Unido sobe a 53,9 em abril, com avanço em serviços, diz S&P Global","O índice de gerentes de compras (PMI, na sigla em inglês) composto do Reino Unido, que engloba os setores industrial e de serviços, subiu de 52,2 em março para 53,9 em abril, atingindo o maior nível em 12 meses, segundo dados preliminares divulgados nesta sexta-feira, 21, pela S&P Global em parceria com a CIPS. O […]",21/04/2023 07:30
economia,Caça da Rússia bombardeia cidade no próprio país,"Explosão fere moradores, abre cratera de 20 metros e danifica carros e prédios em Belgorod, na fronteira com a Ucrânia. Avião supersônico “descarregou munição acidentalmente”, segundo Ministério da Defesa russo.",21/04/2023 07:28
economia,"Zona do euro: PMI composto avança a 54,4 em abril, sustentado por serviços, afirma S&P Global","O índice de gerentes de compras (PMI, na sigla em inglês) composto da zona do euro, que engloba os setores industrial e de serviços, subiu de 53,7 em março para 54,4 em abril, atingindo o maior nível em 11 meses, segundo dados preliminares divulgados nesta sexta-feira, 21, pela S&P Global. O resultado superou a expectativa […]",21/04/2023 07:27
economia,"PMI composto da Alemanha sobe a 53,9 em abril, graças a serviços, diz S&P Global","O índice de gerentes de compras (PMI, na sigla em inglês) composto da Alemanha, que engloba os setores industrial e de serviços, subiu de 52,6 em março para 53,9 em abril, atingindo o maior nível em 12 meses, segundo dados preliminares divulgados nesta sexta-feira, 21, pela S&P Global. O resultado superou a expectativa de analistas […]",21/04/2023 07:23
economia,"OMC, Banco Mundial e Fórum Econômico Mundial lançam iniciativa unindo comércio e clima","A Organização Mundial do Comércio (OMC), o Banco Mundial e o Fórum Econômico Mundial lançaram nesta quinta-feira (21) uma iniciativa conjunta, com o objetivo de fornecer análises personalizadas de comércio e crise climática. Nomeado “Ação sobre Clima e Comércio” (ACT), o projeto terá como foco ajudar economias em desenvolvimento a atingir metas de mitigação climática.",21/04/2023 07:10
economia,"Vendas no varejo do Reino Unido caem 0,9% em março ante fevereiro","As vendas no varejo do Reino Unido caíram 0,9% em março ante fevereiro, segundo dados publicados nesta sexta-feira, 21, pelo ONS, como é conhecido o órgão de estatísticas do país. O resultado ficou abaixo da expectativa de analistas consultados pelo The Wall Street Journal, que previam queda menor nas vendas do período, de 0,6%. Em […]",21/04/2023 07:05
economia,Aliados ponderam proibição quase total às exportações para a Rússia,"Alguns dos países aliados da Ucrânia, incluindo os EUA, estão considerando avançar para uma proibição quase total das exportações para a Rússia, num renovado esforço para pressionar economicamente o regime de Putin para colocar um ponto final à guerra. O G7 – grupo das principais economias do mundo – está discutindo a ideia nas vésperas […]",21/04/2023 03:21
economia,STF tem três votos para liberar retorno da contribuição sindical,"O Supremo Tribunal Federal (STF) começou a julgar um recurso para analisar a legalidade da extinção da obrigatoriedade da contribuição sindical, aprovada pelo Congresso na reforma trabalhista de 2017. O caso é analisado no plenário virtual da Corte desde sexta-feira (14). Até o momento, os ministros Gilmar Mendes, relator, Luís Roberto Barroso e Cármen Lúcia […]",20/04/2023 22:30
economia,BC/Aragão: Há feliz coincidência de aprimoramento de SML e interesse em integração do Mercosul,"O chefe Adjunto do Departamento de Assuntos Internacionais do Banco Central, Marcelo Aragão, afirmou que é uma feliz coincidência o aprimoramento realizado no Sistema de Pagamentos em Moeda Local (SML) e o desejo do governo Lula de aumentar a integração com o Mercosul. Ele disse que “até o momento” não chegou nenhum pedido do Palácio […]",20/04/2023 21:56
economia,BC/Pereira: Medida de derivativos de crédito é parte de ação maior para desenvolver crédito,"O chefe do Departamento de Regulação do Sistema Financeiro Nacional do Banco Central, João André Pereira, afirmou que as alterações nas regras de derivativos de crédito aprovadas pelo Conselho Monetário Nacional (CMN) nesta quinta-feira, 20, fazem parte do “movimento maior” do governo para desenvolver o mercado de crédito. “Essa medida não estava relacionada no pacote […]",20/04/2023 21:47
economia,CMN reformula regras de operações de derivativos de créditos por instituições financeiras,"O Conselho Monetário Nacional (CMN) decidiu, em reunião ordinária nesta quinta-feira, 20, reformular as regras que disciplinam a realização de operações de derivativos de crédito por instituições financeiras e demais instituições autorizadas a funcionar pelo Banco Central. Segundo o BC, a mudança busca adaptar a regulamentação brasileira às inúmeras transformações pelas quais passou esse mercado […]",20/04/2023 21:45
economia,CMN altera regras de sistema de pagamentos que permite trocas em moedas locais no Mercosul,"O Conselho Monetário Nacional (CMN) promoveu, em reunião ordinária nesta quinta-feira, 20, mudanças no Sistema de Pagamentos em Moeda Local (SML), que permite que transações entre empresas e pessoas do Mercosul (Brasil, Argentina, Paraguai e Uruguai) aconteçam nas respectivas moedas locais. Segundo o Banco Central, as alterações simplificam e uniformizam procedimentos do sistema e ampliam […]",20/04/2023 21:38
