Secao,Titulo,Descrição,Data
negocios,Chile planeja estatizar indústria de lítio do país,"Por Alexander Villegas e Ernest Scheyder SANTIAGO (Reuters) – O presidente do Chile, Gabriel Boric, disse nesta quinta-feira que vai nacionalizar a indústria de lítio do país, o segundo maior produtor mundial do metal essencial para baterias de veículos elétricos, para impulsionar sua economia e proteger seu meio ambiente. O movimento de choque no país […]",21/04/2023 14:52
negocios,Ações europeias terminam quinta semana em alta,"Por Shreyashi Sanyal (Reuters) – As ações europeias fecharam em alta nesta sexta-feira, com fortes ganhos trimestrais impulsionando as ações da SAP e da EssilorLuxottica, compensando a queda nas mineradoras. O índice pan-europeu STOXX 600 subiu 0,4%, registrando sua quinta semana consecutiva de ganhos. A fabricante de software empresarial SAP SE saltou 5,2% para seu […]",21/04/2023 14:39
negocios,EUA: reguladores propõem fortalecer supervisão de áreas não bancárias do setor financeiro,"O Conselho de Estabilidade Financeira (FOSC, na sigla em inglês) dos Estados Unidos revelou, nesta sexta-feira, uma proposta para fortalecer os instrumentos de supervisão das áreas não bancárias do setor financeiro. O pacote regulatório foi aprovado de forma unânime pelos integrantes do Conselho e será submetido à consulta pública por 60 dias. A reforma busca […]",21/04/2023 14:28
negocios,Atividade empresarial nos EUA sobe para máxima de 11 meses em abril,"WASHINGTON (Reuters) – A atividade empresarial nos Estados Unidos acelerou para o nível mais alto em 11 meses em abril, de acordo com uma pesquisa nesta sexta-feira, que ficou em desacordo com os sinais crescentes de que a economia está em perigo de entrar em recessão à medida que as taxas de juros mais altas […]",21/04/2023 13:20
negocios,Agenda de Lula no dia 24 em Portugal será reservada a negócios e assinatura de acordos,"A agenda de segunda-feira, dia 24, do presidente Luiz Inácio Lula da Silva em Portugal será praticamente toda reservada aos negócios. Logo cedo, o presidente vai deslocar-se de Lisboa para Matosinhos, cidade próxima ao Porto, no Norte do país, onde ocorrerá o Fórum Empresarial Portugal-Brasil. O evento, previsto para começar às 10h, deve reunir cerca […]",21/04/2023 13:16
negocios,Recuperação da zona do euro ganha ritmo inesperadamente em abril,"(Reuters) – A recuperação econômica da zona do euro ganhou ritmo inesperadamente neste mês, uma vez que o setor de serviços, dominante no bloco, viu uma demanda já aquecida crescer, mais do que compensando o aprofundamento da desaceleração na manufatura, mostraram pesquisas. O Índice de Gerentes de Compras Composto (PMI) do HCOB, compilado pela S&P […]",21/04/2023 13:04
negocios,Chile anuncia plano para nacionalizar produção de lítio,"O presidente do Chile, Gabriel Boric, anunciou um plano nesta quinta-feira, 20, para exigir que empresas privadas aceitem o governo do Chile como parceiro na extração de lítio, que tem alta demanda em todo o mundo para uso em baterias elétricas. Boric afirmou que o Estado participará de todo o ciclo de produção de lítio […]",21/04/2023 12:48
negocios,"Congresso deve fazer alterações, mas essência do arcabouço fiscal será mantida, diz Pacheco","LONDRES (Reuters) – O presidente do Senado, Rodrigo Pacheco, afirmou nesta sexta-feira que o Congresso poderá fazer mudanças na proposta de arcabouço fiscal enviada pelo Executivo esta semana, mas que a essência do projeto será mantida e isso não atrasará a tramitação. “Temos melhorias que podem ser feitas, mas acredito que o governo poderá manter […]",21/04/2023 12:45
negocios,Autoridade antitruste da Itália age contra Meta,"MILÃO (Reuters) – A autoridade antitruste da Itália disse nesta sexta-feira que tomou medidas contra a Meta Platform por um suposto abuso de sua posição no país, em uma investigação envolvendo os direitos de músicas postadas nas plataformas do grupo. Meta, o grupo americano dono do Facebook, WhatsApp e Instagram, não conseguiu no mês passado […]",21/04/2023 11:23
negocios,P&G supera expectativas de lucro e receita no 3º trimestre fiscal,"A Procter & Gamble (P&G) divulgou nesta sexta-feira, 21, que teve lucro líquido de US$ 3,4 bilhões em seu terceiro trimestre fiscal (encerrado em março), valor 2% maior do que o ganho de igual período do ano passado. O lucro ajustado por ação ficou em US$ 1,37, acima da previsão de analistas consultados pela FactSet, […]",21/04/2023 09:21
negocios,"Dívida da Oi sobe para R$ 44,3 bilhões, alta de 1,4%","A Oi protocolou a sua lista atualizada de credores dentro do seu segundo processo de recuperação judicial. Os documentos trouxeram uma atualização no valor concursal da dívida, que subiu de R$ 43,7 bilhões para R$ 44,3 bilhões, portanto, acréscimo de aproximadamente R$ 600 milhões, ou 1,4%. O Estadão/Broadcast (sistema de notícias em tempo real do […]",21/04/2023 08:29
negocios,"Gramado Parks, dona do Snowpark, entra em recuperação judicial","A Justiça do Rio Grande do Sul aceitou o pedido de recuperação judicial de três empresas do Grupo Gramado Parks, dona do parque temático Snowpark e Acquamotion, em Gramado (RS). As dívidas dos três negócios da companhia envolvidos na recuperação (GPV, ARC Rio e BPQ) somam R$ 452 milhões. Na decisão, o juiz Silvio Viezzer, […]",21/04/2023 08:24
negocios,"OMC, Banco Mundial e Fórum Econômico Mundial lançam iniciativa unindo comércio e clima","A Organização Mundial do Comércio (OMC), o Banco Mundial e o Fórum Econômico Mundial lançaram nesta quinta-feira (21) uma iniciativa conjunta, com o objetivo de fornecer análises personalizadas de comércio e crise climática. Nomeado “Ação sobre Clima e Comércio” (ACT), o projeto terá como foco ajudar economias em desenvolvimento a atingir metas de mitigação climática.",21/04/2023 07:10
negocios,Petrobras aprova 3 indicações para Transpetro,"A Petrobras informou nesta quinta-feira, 20, que sua diretoria executiva, em reunião realizada hoje, aprovou três indicações para a Transpetro: Sergio Hermes Martello Bacci para presidir a empresa, Fernando Mascarenhas Cavalcanti de Barros para diretor Financeiro e Jones Alexandre Barros Soares para diretor de Transporte Marítimo, Dutos e Terminais. As indicações estão sujeitas à eleição […]",20/04/2023 22:09
negocios,"Rumo aprova avaliação de potencial proposta de reorganização, com cisão parcial da Malha Norte","SÃO PAULO (Reuters) – O Conselho de Administração da Rumo aprovou a avaliação de uma potencial prosposta de reorganização societária, que inclui a cisão parcial da Malha Norte. Se considerada, a proposta ainda deverá ser submetida à aprovação dos acionistas das duas empresas, acrescentou a empresa em fato relevante divulgado nesta quinta-feira. Segundo a Rumo, […]",20/04/2023 21:53
negocios,CMN reformula regras de operações de derivativos de créditos por instituições financeiras,"O Conselho Monetário Nacional (CMN) decidiu, em reunião ordinária nesta quinta-feira, 20, reformular as regras que disciplinam a realização de operações de derivativos de crédito por instituições financeiras e demais instituições autorizadas a funcionar pelo Banco Central. Segundo o BC, a mudança busca adaptar a regulamentação brasileira às inúmeras transformações pelas quais passou esse mercado […]",20/04/2023 21:45
negocios,CMN altera regras de sistema de pagamentos que permite trocas em moedas locais no Mercosul,"O Conselho Monetário Nacional (CMN) promoveu, em reunião ordinária nesta quinta-feira, 20, mudanças no Sistema de Pagamentos em Moeda Local (SML), que permite que transações entre empresas e pessoas do Mercosul (Brasil, Argentina, Paraguai e Uruguai) aconteçam nas respectivas moedas locais. Segundo o Banco Central, as alterações simplificam e uniformizam procedimentos do sistema e ampliam […]",20/04/2023 21:38
negocios,BHP vê demanda da China com otimismo; produção trimestral de minério de ferro cai,"Por Sameer Manekar (Reuters) – A mineradora global BHP Group Ltd disse nesta quinta-feira que está otimista sobre a demanda de seu principal consumidor, a China, e reafirmou sua perspectiva positiva para a demanda por commodities, mesmo com a empresa relatando uma produção de minério de ferro quase estável da Austrália Ocidental no terceiro trimestre. […]",20/04/2023 21:29
negocios,"Consultoria pede falência da Tok&Stok por dívida de R$ 3,8 milhões; empresa contesta valor","A consultoria de tecnologia Domus Aurea, com sede em Barueri (SP), pediu a falência da Tok&Stok em um tribunal de São Paulo. A alegação é que a varejista tem uma dívida de R$ 3,8 milhões, referente a um projeto que foi suspenso. O valor é questionado pela Tok&Stok, de acordo com fontes. O pedido de […]",20/04/2023 21:09
negocios,"Consultoria pede falência da Tok&Stok por dívida de R$ 3,8 milhões; empresa contesta valor","A consultoria de tecnologia Domus Aurea, com sede em Barueri (SP), pediu a falência da Tok&Stok em um tribunal de São Paulo. A alegação é que a varejista tem uma dívida de R$ 3,8 milhões, referente a um projeto que foi suspenso. O valor é questionado pela Tok&Stok, de acordo com fontes. O pedido de […]",20/04/2023 21:09
negocios,Shein diz que pretende manter preços no Brasil e que cumpre legislação,"SÃO PAULO (Reuters) – A empresa de comércio eletrônico Shein disse que pretende manter os níveis de preços praticados no Brasil mesmo com o início de uma produção local, já que visa compensar maiores custos de fabricação com economias em logística, disse o presidente do conselho da empresa para a América Latina, Marcelo Claure, em […]",20/04/2023 21:07
negocios,Nubank cita ‘publicidade negativa’ e ‘especulações’ sobre asset da fintech em janeiro,"Ao tratar de riscos reputacionais relacionados a seu negócio, o Nubank afirma que a área de gestão de recursos da fintech foi alvo de “publicidade negativa” e “especulações” em janeiro deste ano. Embora a fintech não dê maiores detalhes, é possível inferir que essas especulações estão relacionadas à recuperação judicial da Americanas. Em janeiro, cotistas […]",20/04/2023 21:03
negocios,Shein estabelece parceria com empresas de tecidos de Minas Gerais,"SÃO PAULO (Reuters) – A Shein estabeleceu uma parceria com a empresa brasileira de tecidos Coteminas e sua coligada Santanense, ambas de Minas Gerais, mostrou fato relevante da controladora das duas, Springs Global, nesta quinta-feira, na esteira do anúncio de investimentos milionários no Brasil nos próximos anos. Segundo o documento, o “memorando de entendimentos” assinado […]",20/04/2023 20:33
negocios,"Nubank: David Vélez recebeu remuneração de US$ 350,5 mil em 2022","No ano passado, o CEO e cofundador do Nubank, David Vélez, recebeu remuneração de R$ 350,5 mil (o equivalente a cerca de R$ 1,8 milhão) por seu trabalho na fintech, de acordo com o formulário 20F divulgado pela empresa na SEC, a CVM americana, nesta quinta-feira, 20. Não houve o pagamento de outros valores adicionais […]",20/04/2023 20:16
negocios,"Mercado Livre vai contratar 5,7 mil profissionais em 2023","O Mercado Livre anunciou a ampliação do seu quadro de colaboradores no Brasil. Ao todo, mais de 5.700 profissionais serão integrados a diferentes equipes ao longo do ano no modelo híbrido. As áreas de Tecnologia e Produto devem absorver a maioria das vagas, que contemplam diversas posições e localidades. Ao final de 2023, o quadro […]",20/04/2023 20:11
negocios,Justiça indefere pedidos de credores para suspensão de liminar concedida à Light,"O desembargador José Carlos Paes, da 12ª Câmara de Direito Privado do Tribunal de Justiça do Estado do Rio de Janeiro (TJRJ), decidiu negar três pedidos para suspender a decisão que deu à Light o direito de adiar o pagamento de dívidas. Em relação ao pedido feito por um grupo de três grandes gestoras – […]",20/04/2023 19:56
negocios,Enauta bate recorde de produção diária de 32 mil barris de óleo equivalente,"Por Marta Nogueira e Alberto Alerigi RIO DE JANEIRO (Reuters) – A petroleira brasileira Enauta registrou na véspera um recorde de produção diária de 32 mil barris de óleo equivalente em seus ativos, diante de avanços operacionais disse à Reuters nesta quinta-feira o presidente da companhia, Décio Oddone. O volume, que superou o recorde diário […]",20/04/2023 19:31
negocios,Preços do petróleo caem 2% com temores de recessão e alta de estoques de gasolina nos EUA,"Por Laila Kearney NOVA YORK (Reuters) – Os preços do petróleo caíram nesta quinta-feira cerca de 2 dólares o barril para seu nível mais baixo desde o final de março, pressionados por temores de que uma possível recessão possa prejudicar a demanda por combustível e após um aumento nos estoques de gasolina nos EUA. O […]",20/04/2023 19:31
negocios,"Governo simplifica sistema de pagamentos em moeda local com Argentina, Paraguai e Uruguai","SÃO PAULO (Reuters) – Por Fabrício de Castro SÃO PAULO, 20 Abr (Reuters) – O Banco Central informou nesta quinta-feira que o Conselho Monetário Nacional (CMN) aprovou resolução que simplifica e uniformiza procedimentos do Sistema de Pagamentos em Moeda Local (SML), que reúne Brasil, Argentina, Paraguai e Uruguai. Esse sistema permite que transações entre empresas […]",20/04/2023 19:26
negocios,Wall St cai após resultado trimestral da Tesla e outros balanços decepcionantes,"Por Lewis Krauskopf e Sruthi Shankar e Ankika Biswas (Reuters) – Os principais índices de ações dos Estados Unidos fecharam em queda nesta quinta-feira, após relatórios trimestrais decepcionantes de empresas como Tesla e AT&T, enquanto investidores buscavam clareza sobre a trajetória da taxa de juros. As ações da Tesla caíram 9,7% depois que a fabricante […]",20/04/2023 18:38
negocios,Shein anuncia investimento de R$750 mi prevendo geração de 100 mil novos empregos,"A marca de fast fashion Shein anunciou nesta quinta-feira (20) o investimento de R$750 milhões no Brasil nos próximos três anos para aumentar a competitividade de fabricantes têxteis brasileiras, por meio de tecnologias e treinamento. Segundo a empresa, o objetivo é que as fábricas possam modernizar seus modelos de produção. A parceria com cerca de […]",20/04/2023 18:34
negocios,BuzzFeed demite 15% da força de trabalho e encerra divisão de notícias; ação desaba 20% em NY,"A BuzzFeed informou, nesta quinta-feira, 20, que demitirá cerca de 15% de sua força de trabalho e encerrará o BuzzFeed News como uma empresa autônoma, à medida que o fundador e CEO Jonah Peretti disse que a empresa enfrenta “mais desafios do que posso contar nos últimos anos.” O diretor de receita, Edgar Hernandez, e […]",20/04/2023 18:00
negocios,"Ibovespa tem leve alta em sessão de ajuste, mas registra queda semanal","Por Andre Romani SÃO PAULO (Reuters) – O Ibovespa fechou em leve alta nesta quinta-feira, antes de feriado de Tiradentes no Brasil, destoando de Wall Street, com certa correção após queda de mais de 2% na véspera. Apesar do desempenho positivo na sessão, o Ibovespa encerrou a semana no vermelho, diante, em especial, de preocupações […]",20/04/2023 17:56
negocios,Alphabet combinará unidades de pesquisa de inteligência artificial Google Brain e DeepMind,"(Reuters) – A Alphabet está unindo o Google Brain e o DeepMind, enquanto intensifica a pesquisa em inteligência artificial em sua corrida para competir com sistemas rivais como o chatbot ChatGPT, da OpenAI. A nova divisão será liderada pelo presidente-executivo da DeepMind, Demis Hassabis, e sua criação garantirá o “desenvolvimento ousado e responsável da inteligência […]",20/04/2023 17:55
negocios,Haddad promete ao varejo plano para adequar compras de plataformas asiáticas,"O ministro da Fazenda, Fernando Haddad, prometeu nesta quinta-feira a empresários do varejo que vai trabalhar em um plano de adequação das compras feitas em lojas de comércio eletrônico asiáticas. Um dos objetivos é assegurar que o imposto seja cobrado na transação. Ao deixar a audiência com Haddad no gabinete do ministério da Fazenda em […]",20/04/2023 17:48
negocios,Associação de minoritários faz pedido à CVM sobre 3R Petroleum,"Por Rodrigo Viga Gaier RIO DE JANEIRO (Reuters) – A Abradin, associação de acionistas minoritários de empresas de capital aberto, anunciou nesta quinta-feira que fez à Comissão de Valores Mobiliários (CVM) pedido de investigação citando supostas irregularidades na 3R Petroleum, que anunciou recentemente uma oferta de ações que derrubou o preço do papel. A Abradin […]",20/04/2023 17:37
negocios,Dólar à vista cai ante real com realização de lucros e influência do exterior,"Por Fabrício de Castro SÃO PAULO, 20 Abr (Reuters) – Após a forte alta da véspera, com investidores reagindo negativamente ao texto do novo arcabouço fiscal, o dólar fechou em baixa nesta quinta-feira, com a sessão conduzida por certa realização de lucros e pelo viés negativo da moeda norte-americana durante a tarde no exterior. O […]",20/04/2023 17:34
negocios,"Renault escolhe bancos para IPO da unidade de carros elétricos Ampere, diz fonte","Por Silvia Aloisi PARIS (Reuters) – A Renault escolheu o BNP Paribas, Goldman Sachs e JPMorgan entre os bancos de investimento destinados a trabalhar na listagem planejada de sua unidade de carros elétricos, a Ampere, disse uma fonte próxima ao assunto nesta quinta-feira. Os três bancos atuarão juntos como coordenadores globais na oferta pública inicial […]",20/04/2023 17:28
negocios,Shein anuncia que vai fabricar roupas no Brasil e prevê investir R$ 750 mi no País,"A varejista de moda chinesa Shein anunciou nesta quinta-feira, 20, que vai começar a fabricar suas roupas no Brasil, em um investimento que pode gerar 100 mil empregos em três anos. Inicialmente, deve gastar R$ 750 milhões para fornecer tecnologias e treinamento a fabricantes têxteis brasileiros. O anúncio acontece em meio a pressão de concorrentes […]",20/04/2023 17:21
negocios,Hotel de Trancoso aparece em lista dos 100 melhores do mundo; saiba qual,"Um hotel luxuoso brasileiro apareceu no ranking dos 100 melhores hotéis do mundo, segundo a revista Travel + Leisure. “O Fasano combinou seu estilo urbano característico com a vida descontraída à beira-mar, oferecendo 40 bangalôs modernos e luxuosos escondidos entre altas palmeiras e vegetação exuberante”, escreve a publicação que elegeu a unidade da franquia de […]",20/04/2023 17:12
negocios,Taxas dos contratos de DI caem em dia de ajuste após pessimismo com arcabouço,"Por Fabrício de Castro SÃO PAULO, 20 Abr (Reuters) – As taxas dos contratos futuros de juros recuaram nesta quinta-feira em toda curva a termo, em um movimento de ajuste após o forte avanço da véspera –quando investidores reagiram negativamente ao texto do novo arcabouço fiscal– e em meio ao recuo dos rendimentos dos Treasuries, […]",20/04/2023 16:56
negocios,BuzzFeed fechará divisão de notícias e demitirá 15% da equipe,"(Reuters) – O BuzzFeed disse que fechará sua divisão de notícias para consolidar seu conteúdo de notícias no HuffPost e reduzirá sua força de trabalho em 15%, fazendo com que as ações da empresa de mídia digital caíssem 10% nesta quinta-feira. A segunda rodada de demissões afetará 180 funcionários, incluindo equipes de negócios, conteúdo, tecnologia […]",20/04/2023 15:49
negocios,"Banco Inter pede que funcionários evitem cabelo sem corte, chulé, bolsa velha e roupa amassada","Telefone celular com capinha velha, acessórios sujos ou estragados, chulé e cabelo desarrumado. Esses são alguns dos itens listados pelo Banco Inter em cartilha compartilhada com funcionários que traz “dicas” de estilo e comportamento sugeridas durante o expediente. O documento, intitulado de “os inimigos da imagem”, reúne 14 normas para serem evitadas “a todo custo”. […]",20/04/2023 15:13
negocios,Shein promete investir R$750 mi para ter produção no Brasil,"SÃO PAULO (Reuters) – A marca de fast fashion chinesa Shein anunciou nesta quinta-feira que vai investir 750 milhões de reais no Brasil nos próximos anos para estabelecer uma rede com milhares de fabricantes do setor têxtil no país. A companhia, que anunciou também um marketplace para produtos e vendedores no Brasil, afirmou que pretende […]",20/04/2023 15:02
negocios,"16ª Vara Cível da capital de Alagoas determina bloqueio cautelar de R$ 1,1 bi da Braskem","A 16ª Vara Cível da capital de Alagoas determinou o bloqueio cautelar de aproximadamente R$ 1,1 bilhão em contas bancárias da Braskem. A medida está relacionada a ações ajuizadas contra a companhia sobre “eventos geológicos” ocorridos no estado, segundo comunicado ao mercado. O incidente ocorreu em 2018 quando um abalo sísmico na região deixou rachaduras […]",20/04/2023 14:51
negocios,Amazon lança programa para identificar e rastrear falsificadores,"Por Arriana McLymore NOVA YORK (Reuters) – A Amazon lançou o Anti-Counterfeiting Exchange (ACX), uma iniciativa para ajudar as lojas de varejo a rotular e rastrear produtos falsificados na plataforma como parte dos esforços da gigante do comércio eletrônico para reprimir a pirataria em sua plataforma, anunciou a empresa na quinta-feira. Os mercados online nos […]",20/04/2023 14:47
negocios,Yellen critica China por servir como “obstáculo” no processo de reestruturação da dívida,"Por Andrea Shalal WASHINGTON (Reuters) – Como maior credor bilateral oficial do mundo, a China deveria participar de um alívio significativo da dívida para os países que enfrentam problemas, mas o país serviu por muito tempo como um “obstáculo” para a ação necessária, disse a secretária do Tesouro dos Estados Unidos, Janet Yellen, em um […]",20/04/2023 14:46
negocios,"Custos e provisões da AmEx reduzem lucro, apesar de alta no uso do cartão de crédito","Por Siddarth S e Niket Nishant (Reuters) – O lucro da American Express ficou abaixo das estimativas de Wall Street nesta quinta-feira, apesar dos gastos mais altos de seus clientes, já que a gigante dos cartões de crédito reteve uma grande quantia para cobrir possíveis inadimplências e gastou mais em promoções. As ações da empresa […]",20/04/2023 14:46
negocios,Haddad diz que Shein pretende nacionalizar 85% das vendas nos próximos anos,"O ministro da Fazenda, Fernando Haddad, afirmou nesta quinta-feira, 20, que a e-commerce chinesa Shein pretende nacionalizar 85% de suas vendas em quatro anos, com produtos feitos no Brasil. O anúncio deve ser feito ainda nesta quinta pela Shein, adiantou o ministro, que se reuniu com a empresa no período da manhã. “Eles próprios vão […]",20/04/2023 14:36
negocios,Ações europeias fecham em baixa com balanços fracos; Tesla derruba montadoras,"Por Shreyashi Sanyal (Reuters) – As ações europeias fecharam em baixa pela segunda sessão consecutiva nesta quinta-feira, após balanços corporativos decepcionantes, enquanto montadoras recuaram depois dos fracos resultados trimestrais da Tesla, fabricante de veículos elétricos dos Estados Unidos. O índice pan-europeu STOXX 600 fechou em queda de 0,15%, a 467,43 pontos, enquanto a Nordic Semiconductor […]",20/04/2023 14:34
negocios,"BC da Argentina debaterá alta de juros, mas nenhuma decisão foi tomada, dizem fontes","Por Eliana Raszewski e Jorge Otaola e Walter Bianchi BUENOS AIRES (Reuters) – O conselho do banco central da Argentina debaterá um possível ajuste da taxa de juros em sua reunião semanal nesta quinta-feira, enquanto o país luta contra uma inflação anual de 104%, disseram quatro fontes próximas à instituição, embora nenhuma decisão tenha sido […]",20/04/2023 14:27
negocios,Coinbase obtém licença para operar nas Bermudas,"Por Elizabeth Howcroft LONDRES (Reuters) – A Coinbase, principal bolsa de criptomoedas dos Estados Unidos, disse que obteve uma licença para operar nas Bermudas, como parte de um esforço mais amplo de expansão global. A Coinbase obteve uma licença da Autoridade Monetária das Bermudas, que lhe permite operar como uma empresa de ativos digitais na […]",20/04/2023 13:48
negocios,"Haddad sobre e-commerce: governo seguirá países desenvolvidos, com imposto digital à empresa","O ministro da Fazenda, Fernando Haddad, afirmou nesta quinta-feira, 20, que o governo pretende solucionar a questão da taxação do e-commerce seguindo o exemplo de países desenvolvidos, com um imposto digital. O ministro também disse que a alternativa atende a sinalização do presidente da República, Luiz Inácio Lula da Silva, que pediu uma solução administrativa […]",20/04/2023 13:38
negocios,TSMC espera queda nas vendas do 2° tri,"Por Yimou Lee e Sarah Wu Taipé (Reuters) – A fabricante de chips TSMC, um importante fornecedor da Apple, prevê uma queda de 16% nas vendas para o segundo trimestre, à medida que os clientes lidam com um excesso de estoque, enquanto o enfraquecimento da economia global reduz as perspectivas de demanda. A maior fabricante […]",20/04/2023 13:17
negocios,Usiminas vê chance de margens mais apertadas no 2º tri,"SÃO PAULO (Reuters) – A Usiminas está vendo a possibilidade de “margens mais apertadas” no segundo trimestre, diante de um cenário de custos de matéria-prima em alta e uma demanda por aço pressionada por fatores como restrições ao crédito e juros elevados, disse o diretor financeiro, Thiago Rodrigues, nesta quinta-feira. “Em termos gerais, a gente […]",20/04/2023 13:12
